ServiceID,ServiceNameAr,ServiceNameEn,EntityAr,EntityEn,EntityID,EntityDepartmentAr,EntityDepartmentEn,Beneficiary,MainService,DescriptionAr,DescriptionEn,SpecialConditionsAr,SpecialConditionsEn,RequiredDocumentsAr,RequiredDocumentsEn,FeesAr,FeesEn,PaymentMethod,AvgTimeTakenAr,AvgTimeTakenEn,WorkingTimeAr,WorkingTimeEn,Channels,InputChannelOthers,CustomerCarePhone,Website,ProcessStepsAr,ProcessStepsEn,NumSteps,AudienceVisitCount,ServiceURL
100306,التسجيل للمغادرة خلال فترة السماح,Registration For Departure Within The Grace Period,وزارة العمل,Ministry of Labour,124,,,من الحكومة الى الأفراد(G2C),خدمات القوى العاملة > التسجيل للمغادرة خلال فترة السماح,خدمة تسمح للموظف الوافد بالتسجيل لإنهاء عقد العمل ومغادرة سلطنة عُمان خلال فترة السماح الممنوحة بعد انتهاء العقد أو الإنهاء.,A service that allows an expatriate employee to register for termination of employment and departure from the Sultanate of Oman within the grace period granted after contract expiry or termination.,,,البطاقة المدنية ; جواز السفر ; عقد العمل الأصلي أو نسخة معتمدة ; إشعار إنهاء العقد من صاحب العمل أو خطاب التنازل عن فترة الإشعار,Civil ID ; Passport ; Original employment contract or certified copy ; Termination notice from employer or waiver letter for notice period,لا يوجد,,الكتروني,من 5 أيام إلى 7 أيام,,,,بوابة الخدمات الإلكترونية - الموقع الإلكتروني مكاتب سند,,+968 80077000,www.mol.gov.om,,,0,,https://www.mol.gov.om/ManpowerAllEServices/Details/Registration-for-Departure-within-the-Grace-Period-306
100307,قدّم على وظيفة في القطاع الخاص,Apply for a job in the private sector,وزارة العمل,Ministry of Labour,124,,,من الحكومة الى الأفراد(G2C),,تمكّنك هذه الخدمة من البحث عن فرص العمل المتاحة في شركات القطاع الخاص، والتقديم عليها.,This service enables you to search and apply for a job in private sector companies.,يجب التقدم على الوظيفة خلال المدة المحددة للتقديم.,You must apply for the job within the application period.,لا توجد مستندات مطلوبة لهذه الخدمة,No documents required for this service.,0,0,الكتروني,3.0 دقيقة,3.0 Mins,,,الموقع الإلكتروني,,+968 80077000,www.mol.gov.om,[1] البحث عن وظيفة || [2] التقدم على الوظيفة || [3] القبول في الوظيفة || [4] تسجيل الدخول || [5] الاختبار أو مقابلة العمل,[1] Search for a job || [2] Apply for the job || [3] Job acceptance || [4] Sign in || [5] Interview or assessment,5,,https://gov.om/ar/w/apply-for-private-sector-job-opportunities
100308,طلبات الترشح لفرص العمل الشاغرة (المنشآت),Display Candidacy Requests Establishments,وزارة العمل,Ministry of Labour,124,,,من الحكومة إلى قطاع الأعمال(G2B),خدمات القوى العاملة العمانية > طلبات الترشح لفرص العمل الشاغرة (المنشآت),هي خدمة تمكن أصحاب العمل من الإطلاع على بيانات المترشحين للفرص الوظيفية الشاغرة، وإدخال نتيجة المقابلة للمتقدم.,This service allows employers to view candidate information for vacant job opportunities and record interview outcomes for applicants.,,,البطاقة المدنية ; سجل تجاري ساري المفعول ; رقم الترخيص المهني للمنشأة,Civil ID ; Valid commercial registration ; Establishment’s professional license number,لا يوجد,,الكتروني,خدمة ذاتية.,,,,بوابة الخدمات الإلكترونية - الموقع الإلكتروني مكاتب سند,,+968 80077000,www.mol.gov.om,[2] الإطلاع على بيانات المترشحين. 3-إدخال نتيجة المقابلة. 4-للمزيد من التفاصيل يرجى الاطلاع على دليل المستخدم,,1,,https://www.mol.gov.om/ManpowerAllEServices/Details/Display-candidacy-requests-establishments-308
100310,احصل على رسالة لمن يهمه الأمر أو السيرة الذاتية,Get your CV or a To Whom It May Concern letter,وزارة العمل,Ministry of Labour,124,,,من الحكومة الى الأفراد(G2C),,تُمكّنك هذه الخدمة من الحصول على سيرتك الذاتية، أو رسالة لمن يهمه الأمر، التي توضح حالتك الوظيفية لدى وزارة العمل.,This service enables you to get your CV or a To Whom It May Concern letter that confirms your employment status with the Ministry of Labour.,-,-,لا توجد مستندات مطلوبة لهذه الخدمة,No documents required for this service.,0,0,الكتروني,5.0 دقيقة,5.0 Mins,,,الموقع الإلكتروني,,+968 80077000,www.mol.gov.om,[1] تسجيل الدخول || [2] اختيار نوع الملف || [3] عرض الملف || [4] رسالة التأكيد,[1] Sign in || [2] Document selection || [3] Download or print || [4] Confirmation message,4,,https://gov.om/w/get-a-to-whom-it-may-concern-letter-or-cv
100311,سجّل كباحث عن عمل أو حدّث بياناتك,Register as a job seeker or update your information,وزارة العمل,Ministry of Labour,124,,,من الحكومة الى الأفراد(G2C),,تمكّنك هذه الخدمة من التسجيل كباحث عن عمل لدى وزارة العمل أو تحديث بعض بياناتك لديها، مثل الخبرات العملية وبيانات التواصل وغيرها.,"This service enables you to register as a job seeker with the Ministry of Labour or update some of your information, such as work experience and contact details.",,,رخصة القيادة (للوظائف تشترط توفرها) ; وثائق الشهادات والخبرات العملية (مختومة ومصدّقة),Driving licence - if required for the job ; Certificates and evidence of work experience (stamped and attested),0,0,الكتروني,7.0 دقيقة,7.0 Mins,,,الموقع الإلكتروني,,+968 80077000,www.mol.gov.om,[1] تسجيل الدخول || [2] التسجيل كباحث عن عمل أو تحديث البيانات || [3] رسالة التأكيد,[1] Sign in || [2] Information update || [3] Confirmation message,3,,https://gov.om/w/register-job-seeker-s-data-in-manpower-records
100314,الوظائف المتقدم لها,Applied Vacancies,وزارة العمل,Ministry of Labour,124,,,من الحكومة الى الأفراد(G2C),خدمات الباحثين عن عمل > الوظائف المتقدم لها,من خلال هذه الخدمة يمكن للمترشح أو الباحث عن عمل الإطلاع على الفرص المترشح عليها عن طريق الموقع أو تطبيق الهاتف والفرص التي تم ترشيحك عليها من قبل وزارة العمل، كما يمكنك من خلال هذه الصفحة رفض الفرص المترشح عليها ما لم تُدخل الشركة نتيجة الترشح.,"This service allows job seekers to view vacancies they have applied for through the website or mobile app, as well as vacancies for which they have been shortlisted by the Ministry of Labour. Applicants can also reject shortlisted opportunities before the company submits its hiring decision.",,,البطاقة المدنية ; رقم التسجيل في سوق العمل (إذا وُجد) ; رقم الطلب أو رقم الترشيح (إن وُجد),Civil ID ; Labour Market Registration Number (if available) ; Application or Shortlisting Reference Number (if available),,,الكتروني,خدمة ذاتية,,,,بوابة الخدمات الإلكترونية - الموقع الإلكتروني مكاتب سند,,+968 80077000,www.mol.gov.om,[1] تسجيل الدخول على الخدمة من قبل المسخدم من خلال البطاقة المدنية أو بطاقة الهاتف الداعمة لنظام التصديق الالكتروني PKI . || [2] بعــد أن يتــم تســجيل الدخــول ســتظهر لــك شاشــة بهــا الفــرص الوظيفيــة التــي ســبق وتقدمــت لـها عن طريق موقع الوزارة أو تطبـيق مـعاك للهواتف الذكـية . 3-من خلال هذه الخدمة يمكن للمستخدم عرض التفاصيل أو رفض الفرص الشاغرة واختيار سبب الرفض 4-للمزيد من التفاصيل يرجى الاطلاع على دليل المستخدم.,,2,,https://www.mol.gov.om/ManpowerAllEServices/Details/Applied-Vacancies-314
100315,طلبات تعديل بيانات القوى العاملة الوطنية,National Manpower Data Modify Application,وزارة العمل,Ministry of Labour,124,,,من الحكومة الى الأفراد(G2C),خدمات القوى العاملة العمانية > طلبات تعديل بيانات القوى العاملة الوطنية,الخدمة تمكن الطرف الأول صاحب العمل أو من يقوم مقامه من عمل الأتي:,This service allows employers or their authorized representatives to submit requests to update personal or employment-related data of Omani national employees.,,,البطاقة المدنية لصاحب العمل أو الممثل القانوني ; البطاقة المدنية للموظف العماني المراد تعديل بياناته ; خطاب تفويض مصدق من وزارة التجارة والصناعة (إذا كان المقدّم غير صاحب العمل) ; سجل الشركة أو المؤسسة,Civil ID of the employer or authorized representative ; Civil ID of the Omani employee whose data is to be updated ; Notarized power of attorney from the Ministry of Commerce and Industry (if applicant is not the employer) ; Company or establishment commercial registration,بدون رسوم.,,الكتروني,خدمة ذاتية.,,,,بوابة الخدمات الإلكترونية - الموقع الإلكتروني مكاتب سند,,+968 80077000,www.mol.gov.om,"[1] تسجيل الدخول بإستخدام البطاقة المدنية أو بطاقة الهاتف المعززة بالتصديق الالكتروني PKI || [2] إختيار خدمة طلبات تعديل بيانات القوى العاملة العمانية من القائمة الجانبية. || [3] لإضافة طلب تعديل ""جديد"" يقوم مقدم الطلب بالضغط على الرابط وإختيار العامل من سجل القوى العاملة العمانية بالمنشأة، مع مراعاة الإشتراطات الاتية: -لتعديل بيانات عقد العمل يجب أن يكون العامل على رأس العمل، ولديه عقد عمل إلكتروني. -لتعديل المهنة ، يجب أن يكون العامل على رأس العمل. - لتمديـد عقـد العمـل محـدد المـدة ، يجب أن يكون العامل على رأس العمل، ولديه عقد عمل إلكتروني (العقـد محـدد المـدة). - لطباعة العقد، يجب أن يكون عقد العمل لكتروني. - لإنهاء التعاقد ، يجب أن يكون العامل على رأس العمل. - لطباعة استمارة إنهاء العقد ، يجب أن تكون مدة التعاقد منتهية. || [4] لإرسال الطلب - الضغط على زر ""التسليم"" حيث سيتم إرسال الطلب إلى الطرف الثاني (العامل)، ليتمكن من الإطلاع على العقد والموافقة عليه أو رفضه. ملاحظة: للمزيد من التفاصيل يمكن الإطلاع على دليل المستخدم بالموقع الإلكتروني. 5-للمزيد من التفاصيل يرجى الاطلاع على دليل المستخدم.",,4,,https://www.mol.gov.om/ManpowerAllEServices/Details/National-Manpower-Data-Modify-Application-315
100316,قبول طلبات تعديل بيانات القوى العاملة الوطنية,National Manpower Data Modify Acceptance,وزارة العمل,Ministry of Labour,124,,,من الحكومة الى الأفراد(G2C),خدمات القوى العاملة > قبول طلبات تعديل بيانات القوى العاملة الوطنية,مــن خلال هــذه الخدمــة يمكــن للعامــل الإطلاع علــى طلبــات تعديـل بيانـات التعاقـد المدرجـة إليـه مـن قبـل المنشـأة لإتخـاذ اجــراء القبــول الرفــض- طلــب تحديــث.,This service allows Omani nationals to view and accept or reject requests from employers to modify their employment contract data.,,,البطاقة المدنية ; رقم العقد الوظيفي ; رسالة طلب التعديل من الجهة المشغلة,Civil ID ; Employment contract number ; Modification request letter from the employer,لا توجد.,,الكتروني,خدمة ذاتية.,,,,بوابة الخدمات الإلكترونية - الموقع الإلكتروني مكاتب سند,,+968 80077000,www.mol.gov.om,[1] تسجيل الدخول على الخدمة من قبل المستخدم من خلال البطاقة المدنية أو بطاقة الهاتف الداعمة لنظام التصديق الالكتروني PKI. || [2] بعد تسجيل الدخول يمكن للعامل الاطلاع على قائمة طلبات تعديل بيانات القوى العاملة الوطنية المرسله من قبل المنشأة . || [3] الاطلاع على التفاصيل الطلب و إتخاذ أي من الإجراءات التالية : - قبول : في حالة قبول طلب التعديل سيصبح الطلب معتمد وسيتم عكس بيانات التعديل على بيانات العامل وسيتم عكس البيانات على نسخة العقد(في حالة نوع الطلب :تعديل بيانات العقد أو تمديد العقد ). - رفض :في حالة الرفض يمكن للعامل كتابة ملاحظة الرفض و سيكون حالة الطلب مرفوض. - طلب تحديث :في حالة طلب التحديث يمكن للعامل كتابة البيانات المطلوب تحديثها وسيصبح الطلب بإنتظار تعديل صاحب العمل . 4-للمزيد من التفاصيل يرجى الاطلاع على دليل المستخدم.,,3,,https://www.mol.gov.om/ManpowerAllEServices/Details/National-Manpower-Data-Modify-acceptance-316
100317,خدمة تسجيل المشاريع,Project Registration,وزارة العمل,Ministry of Labour,124,,,من الحكومة إلى قطاع الأعمال(G2B),خدمات القوى العاملة الغير عمانية > خدمة تسجيل المشاريع,هي خدمة الكترونية تٌمكن أصحاب العمل (المنشآت) من تسجيل تفاصيل المشاريع الراغبة في تنفيذها ، وبالتالي يمكن للمنشأة تقديم طلبات تراخيص استقدام القوى العاملة غير العمانية للعمل في تلك المشاريع سواء كانت مشاريع حكومية أو خاصة. وتتضمن تفاصيل المشروع اسم ونوع ومدة وقيمة المشروع ، وتفاصيل المقاول الفرعي (طرف ثالث) ، بالإضافة إلى رفع المستندات المتعلقة بالمشروع حسب النشاط وغيرها.,"An electronic service enabling employers (establishments) to register project details for projects they intend to implement, allowing them to subsequently apply for non-Omani workforce recruitment permits for those projects—whether government or private. Project details include name, type, duration, value, and subcontractor (third-party) information, along with uploading project-related documents according to activity.",,,المشاريع الحكومية: اتفاقية المشروع باللغة العربية رسالة من مالك المشروع المشاريع الخاصة: اتفاقية المشروع باللغة العربية ( كل الأنشطة) إباحة البناء المخطط المساحي ( الكروكي ) الملكية أمر الشروع بالبناء رسالة الاستشاري أو اعتماد الاستشاري في الاتفاقية المستندات أعلاه بالمشاريع الخاصة للأنشطة التالية : مقاولات البناء والتشييد (إنشاءات عامة للمباني السكنية والغير سكنية) أنشطة أخرى خاصة بتشييد المباني مقاولات تركيبات الأبنية الترميمات الرئيسية والإضافات,Civil ID ; Project agreement in Arabic ; For government projects: official letter from project owner ; For private projects: building permit ; site layout plan (sketch) ; title deed ; commencement order ; consultant’s letter or consultant’s approval in the agreement,لا يوجد,,الكتروني,- يعتمد وقت معالجة الطلب على استيفاء جميع اشتراطات الوزارة و المستندات المطلوبة .,,,,بوابة الخدمات الإلكترونية - الموقع الإلكتروني مكاتب سند,,+968 80077000,www.mol.gov.om,[1] الدخول على خدمات أصحاب العمل بالموقع الالكتروني للوزارة ، واختيار خدمة تسجيل المشاريع باستخدام قارئ البطاقة الشخصية المزودة بخاصية التصديق الإلكتروني أو الهاتف المزود بشريحة داعمة للتصديق الإلكتروني (PKI). || [2] تعبئة تفاصيل المشروع وتتضمن اسم ونوع و مدة وقيمة المشروع ، وتفاصيل المقاول الفرعي (طرف ثالث) ، وغيرها. || [3] رفع نسخ من المستندات المطلوبة . || [4] مراجعة التفاصيل المدخلة و تقديم الطلب. || [5] سيتحقق موظف الوزارة من تفاصيل الطلب و استيفاء المستندات المرفقة ، ومن ثم سيقوم باتخاذ القرار وفقاً لاشتراطات الوزارة إما بإعتماد أو رفض أو تحديث الطلب. || [6] سيتلقى صاحب العمل إشعار عبر الرسائل النصية القصيرة ، والبريد الالكترونى عند اعتماد أو رفض طلب تسجيل المشروع . و يمكن لصاحب العمل الاطلاع على حالة الطلبات المقدمة في صفحة طلبات تسجيل المشاريع. || [7] بعد اعتماد الطلب ، يمكن لصاحب العمل استخدامه في تقديم طلب تصريح مزاولة العمل,,7,,https://www.mol.gov.om/ManpowerAllEServices/Details/Project-Registration-317
100318,البحث في سجلات الباحثين عن عمل,Searching In Job Seekers Registries,وزارة العمل,Ministry of Labour,124,,,من الحكومة إلى قطاع الأعمال(G2B),خدمات القوى العاملة العمانية > البحث في سجلات الباحثين عن عمل,الخدمة تمكن أصحاب العمل من الإطلاع على سجلات الباحثين عن عمل الذين سمحو بالاطلاع على ملفهم الشخصي وذلك عن طريق اظهار البيانات التي رغبو بعرضها فقط بحيث يسهل على أصحاب العمل البحث عن الباحثين عن عمل حسب المتطلبات لديهم.,"This service allows employers to search the job seekers' registry for candidates who have opted to make their profiles visible, displaying only the information they chose to share, enabling employers to find job seekers matching their requirements.",,,البطاقة المدنية ; شهادة تسجيل صاحب العمل لدى وزارة العمل ; رقم السجل التجاري,Civil ID ; Employer registration certificate with the Ministry of Labour ; Commercial Registration Number,بدون رسوم.,,الكتروني,خدمة ذاتية.,,,,بوابة الخدمات الإلكترونية - الموقع الإلكتروني مكاتب سند,,+968 80077000,www.mol.gov.om,,,0,,https://www.mol.gov.om/ManpowerAllEServices/Details/Searching-In-Job-Seekers-Registries-318
