ServiceID,ServiceNameAr,ServiceNameEn,EntityAr,EntityEn,EntityID,EntityDepartmentAr,EntityDepartmentEn,Beneficiary,MainService,DescriptionAr,DescriptionEn,SpecialConditionsAr,SpecialConditionsEn,RequiredDocumentsAr,RequiredDocumentsEn,FeesAr,FeesEn,PaymentMethod,AvgTimeTakenAr,AvgTimeTakenEn,WorkingTimeAr,WorkingTimeEn,Channels,InputChannelOthers,CustomerCarePhone,Website,ProcessStepsAr,ProcessStepsEn,NumSteps,AudienceVisitCount,ServiceURL
100329,خدمة التسجيل في الوظائف الحكومية,Registration Service For Government Jobs,وزارة العمل,Ministry of Labour,124,,,من الحكومة الى الأفراد(G2C),خدمات الباحثين عن عمل > خدمة التسجيل في الوظائف الحكومية,تمكن هذه الخدمة الباحث عن عمل من التسجيل في الوظائف الشاغرة بالجهات الحكومية بعد نزول اعلانات الوظائف الشاغرة ويكون الباحث عن عمل مستوفيا للشروط المحدد وذلك بالتقدم عبر ارسال رسالة نصية قصيرة او عن طريق التقدم عبر موقع الوزارة.,"This service allows job seekers to register for vacant government positions after job announcements are published, provided they meet the specified eligibility criteria, either by sending an SMS or applying through the Ministry's website.",,,البطاقة المدنية ; صورة شخصية حديثة ; سجل الأكاديمي أو الشهادات المؤهلة ; رسالة تأكيد التقدم عبر الرسائل القصيرة أو الموقع الإلكتروني,Civil ID ; Recent passport-sized photograph ; Academic transcript or qualifying certificates ; Confirmation message of application via SMS or the Ministry's website,لا يوجد,,الكتروني,خدمة ذاتية,,,,بوابة الخدمات الإلكترونية - الموقع الإلكتروني الرسائل النصية القصيرة(SMS),,+968 80077000,www.mol.gov.om,[1] الدخـول علـى موقـع الـوزارة الإلكترونـي www.mol.gov.om || [2] اختر رابط الخدمة في شواغر الوحدات الحكومية || [3] إدخال الرقم المدني ورمز التحقق والنقر على زر الدخول || [4] إدخال كلمة المرور المرسلة الى هاتفك النقال والنقر على دخول || [5] إختيار اعلانات الشواغر || [6] إختيار الاعلان الراغب التقدم فيه || [7] النقر على قائمة الوظائف للبحث عن الوظيفة المناسبة او بلإمكان النقر على احصائيات عدد المتقدمين لمعرفة عدد المتقدمين في كل وظيفة قبل التسجيل في الوظيفة || [8] النقر على عرض الاشتراطات للوظيفة الراغب التسجيل فيها || [9] التقدم للوظيفة بالنقرر على (التقديم لهذه الوظيفة) || [10] كتابة البيانات المطلوبة كاملة واضافة رقم الهاتف والنقر على اعادة ارسال سوف تصل رسالة بكلمة المرور و ادخال كلمة المرور الوارد في الهاتف والنقر على (قدم للوظيفة),,10,,https://www.mol.gov.om/ManpowerAllEServices/Details/Registration-service-for-government-jobs-329
100330,خدمة الوظائف بالقطاع العسكري (تجنيد),Job Service Military Sector,وزارة العمل,Ministry of Labour,124,,,من الحكومة الى الأفراد(G2C),خدمات الباحثين عن عمل > خدمة الوظائف بالقطاع العسكري (تجنيد),تمكن هذه الخدمة من البحث والتسجيل في الوظائف المتوفرة في القطاع العسكري .,This service enables job seekers to search for and register for available positions in the military sector.,,,البطاقة المدنية ; صورة شخصية حديثة ; شهادة المؤهل العلمي ; شهادة اللياقة الطبية,Civil ID ; Recent personal photograph ; Academic qualification certificate ; Medical fitness certificate,لا يوجد,,الكتروني,خدمة ذاتية,,,,بوابة الخدمات الإلكترونية - الموقع الإلكتروني الرسائل النصية القصيرة(SMS),,+968 80077000,www.mol.gov.om,,,0,,https://www.mol.gov.om/ManpowerAllEServices/Details/Job-service-military-sector-330
100331,الالتزامات المالية (المنشآت),Financial Obligations,وزارة العمل,Ministry of Labour,124,,,من الحكومة إلى قطاع الأعمال(G2B),خدمات القوى العاملة العمانية > الالتزامات المالية (المنشآت),تُمكن خدمة الالتزامات المالية أصحاب العمل (المنشآت) من دفع مستحقات الالتزمات المالية المسجلة على المنشأة آلياً من خلال بوابة الدفع الإلكتروني للوزارة.,This service enables employers (establishments) to automatically pay their registered financial obligations through the Ministry's electronic payment portal.,,,البطاقة المدنية أو جواز السفر للممثل القانوني ; سجل تجاري ساري المفعول ; رقم المنشأة في وزارة العمل ; إثبات تسجيل الالتزامات المالية في النظام,Civil ID or passport of the authorized representative ; Valid commercial registration ; Establishment number with the Ministry of Labour ; Proof of financial obligations registered in the system,لا توجد,,الكتروني,خدمة ذاتية,,,,بوابة الخدمات الإلكترونية - الموقع الإلكتروني مكاتب سند,,+968 80077000,www.mol.gov.om,"[1] الدخول على الخدمة من قبل أصحاب العمل (المفوض بالتوقيع أو ممثل المنشأة) من خلال البطاقة المدنية أو بطاقة الهاتف الداعمة لخاصية التصديق الإلكتروني. || [2] اختيار الالتزمات المالية من قائمة الخدمات . || [3] اختيار سجل الالتزام الذي بحالة "" لم تتحقق "" من قائمة الالتزامات و الضغط على خيار عرض تفاصيل الطلب. || [4] الضغط على زر الدفع لمعرفة تفاصيل الفاتورة المسجلة بالالتزامات المالية على المنشأة. || [5] استكمال عملية الدفع الإلكتروني.",,5,,https://www.mol.gov.om/ManpowerAllEServices/Details/Financial-obligations-331
100332,الالتزامات المالية (الأفراد),Financial Obligations Individuals,وزارة العمل,Ministry of Labour,124,,,"من الحكومة إلى قطاع الأعمال(G2B),من الحكومة الى الأفراد(G2C)",خدمات المواطنين > الالتزامات المالية (الأفراد),تمكن خدمة الالتزامات المالية أصحاب العمل (الأفراد) من دفع مستحقات الالتزمات المالية المسجلة على صاحب العمل آلياً من خلال بوابة الدفع الإلكتروني للوزارة.,This service allows individual employers to automatically pay their registered financial obligations through the Ministry's electronic payment portal.,,,البطاقة المدنية ; رقم السجل التجاري (إن وجد) ; رقم صاحب العمل في وزارة العمل,Civil ID ; Commercial Registration Number (if applicable) ; Employer’s number with the Ministry of Labour,لا يوجد,,الكتروني,خدمة ذاتية,,,,بوابة الخدمات الإلكترونية - الموقع الإلكتروني مكاتب سند,,+968 80077000,www.mol.gov.om,"[1] الدخول على الخدمة من قبل الأفراد من خلال البطاقة المدنية أو بطاقة الهاتف الداعمة لخاصية التصديق الإلكتروني. || [2] اختيار الالتزمات المالية من قائمة الخدمات . || [3] اختيار سجل الالتزام الذي بحالة "" لم تتحقق "" من قائمة الالتزامات و الضغط على خيار عرض تفاصيل الطلب. || [4] الضغط على زر الدفع لمعرفة تفاصيل الفاتورة المسجلة بالالتزامات المالية على الفرد. || [5] استكمال عملية الدفع الإلكتروني.",,5,,https://www.mol.gov.om/ManpowerAllEServices/Details/Financial-obligations-individuals-332
100333,طلبات إغلاق فرص العمل الشاغرة (المنشآت),Job Vacancy Cancel Application,وزارة العمل,Ministry of Labour,124,,,من الحكومة إلى قطاع الأعمال(G2B),خدمات القوى العاملة العمانية > طلبات إغلاق فرص العمل الشاغرة (المنشآت),تمكن هذه الخدمة أصحاب العمل من تسجيل طلبات إغلاق فرص العمل الشاغرة لإغلاق فرص العمل الشاغرة المسجلة بالمنشأة حسب الأسباب الممكنة لإغلاقها.,This service allows employers to submit requests to cancel registered job vacancies in their establishment for valid reasons.,,,البطاقة المدنية ; شهادة تسجيل المنشأة لدى وزارة العمل ; رقم الترخيص التجاري ; إثبات سبب الإغلاق (مثل خطاب توضيحي أو وثيقة رسمية),"Civil ID ; Establishment registration certificate from the Ministry of Labour ; Commercial license number ; Proof of closure reason (e.g., explanatory letter or official document)",لا توجد.,,الكتروني,خدمة ذاتية.,,,,بوابة الخدمات الإلكترونية - الموقع الإلكتروني مكاتب سند,,+968 80077000,www.mol.gov.om,"[1] الدخول على الخدمة من قبل أصحاب العمل من خلال البطاقة المدنية أو بطاقة الهاتف الداعمة لنظام التصديق الالكتروني PKI 2-من القائمة الجانبية "" طلبات إغلاق فرص العمل الشاغرة"" يختار المستخدم شاشة "" قائمة طلبات إغلاق فرص العمل الشاغرة "". 3-من خلال شاشة الطلبات، يمكن للمستخدم إنشاء طلب عن طريق النقر على خيار ""انشاء طلب جديد"". 4-يمر الطلب ثلاث مراحل، ينبغي على المستخدم تعبئة حقول البيانات التالية: -بيانات صاحب العمل وبيانات توجيه الطلب - بيانات الفرص المطلوبة للإغلاق - مراجعة الطلب. 5-بعد مراجعة الطلب، والنقر على زر التسليم، يتم ارسال الطلب للمختصين بالوزارة لدراسته وسوف يظهر في قائمة طلبات إغلاق فرص العمل الشاغرة بحالة ""بإنتظار القرار الإداري"". 6-يمكن لمقدم الطلب متابعة حالة الطلب من خلال الموقع الالكتروني والاشعارات المرسلة. 7-للمزيد من التفاصيل يرجى الاطلاع على دليل المستخدم.",,1,,https://www.mol.gov.om/ManpowerAllEServices/Details/Job-Vacancy-Cancel-Application-333
100334,تحديد تاريخ الإحلال للقوى العاملة غير العمانية (القطاع الحكومي),Determining Replacement Date,وزارة العمل,Ministry of Labour,124,,,من الحكومة الى الأفراد(G2C),خدمات القوى العاملة الغير عمانية > تحديد تاريخ الإحلال للقوى العاملة غير العمانية (القطاع الحكومي),تُتيح خدمة تحديد تاريخ الإحلال للجهات بالقطاع الحكومي تحديد تاريخ لإحلال القوى العاملة غير العمانية من خلال تحديد تاريخ معين لإحلال العاملين لديها بهدف توظيف قوى عاملة وطنية.,"This service allows government entities to set a replacement date for non-Omani workers, aiming to replace them with national workforce.",,,البطاقة المدنية للجهة الحكومية المُقدمة للطلب ; خطاب رسمي من الجهة الحكومية يوضح الحاجة إلى إحلال القوى العاملة غير العمانية ; قائمة بأسماء العمال غير العمانيين المطلوب إحلالهم مع تواريخ انتهاء عقودهم ; شهادة تسجيل الموظف في وزارة العمل (إن وجدت),"Civil ID of the requesting government entity ; Official letter from the government entity stating the need to replace non-Omani workers ; List of names of non-Omani workers to be replaced, including their contract expiry dates ; Employee registration certificate from the Ministry of Labour (if applicable)",لا يوجد,,الكتروني,يوم واحد لمراجعة واعتماد الطلب من الدائرة المعنية,,,,بوابة الخدمات الإلكترونية - الموقع الإلكتروني مكاتب سند,,+968 80077000,www.mol.gov.om,[1] الدخول على خدمة تحديد تاريخ الإحلال بخدمات القوى العاملة غير العمانية في خدمات أصحاب العمل من قبل المفوض بالتوقيع بواسطة البطاقة المدنية أو الهاتف الداعمة لخاصية التصديق الإلكتروني. || [2] اختيار الموظف المراد إحلاله في سجل تصريح مزاولة العمل ، واختيار تحديد تاريخ الإحلال من قائمة خيارات إجراءات تصاريح العمل من الشاشة الجانبية . || [3] اختيار التاريخ المحدد للإحلال. || [4] مراجعة الطلب. || [5] إرسال الطلب.,,5,,https://www.mol.gov.om/ManpowerAllEServices/Details/Determining-replacement-date-334
100335,إرجاع العامل على رأس العمل (المنشآت),Reactivate Work Permit,وزارة العمل,Ministry of Labour,124,,,من الحكومة إلى قطاع الأعمال(G2B),خدمات القوى العاملة الغير عمانية > إرجاع العامل على رأس العمل (المنشآت),تُتيح خدمة إرجاع العامل على رأس العمل لأصحاب العمل(المنشآت) تقديم طلب إرجاع العامل على رأس العمل بعد إلغاء تصريح العمل له بالخطأ وبشرط ان يكون العامل داخل السلطنة و تأشيرته ليست ملغيه .,"This service allows employers (establishments) to request the reactivation of a work permit for a foreign worker who was mistakenly cancelled, provided the worker is still in Oman and their visa remains valid.",,,البطاقة المدنية للمؤسسة أو السجل التجاري ; جواز سفر العامل ; تصريح العمل الأصلي أو رقم التصريح الملغى ; إثبات بوجود العامل داخل السلطنة (مثل كشف دخول) ; خطاب توضيحي من المؤسسة يوضح سبب الإلغاء الخاطئ,"Civil ID or commercial registration of the establishment ; Worker's passport ; Original work permit or cancelled permit number ; Proof of worker's presence in Oman (e.g., entry record) ; Explanation letter from the establishment clarifying the erroneous cancellation",لا توجد,,الكتروني,يوم واحد لمراجعة واعتماد الطلب من الدائرة المعنية بالوزارة.,,,,بوابة الخدمات الإلكترونية - الموقع الإلكتروني مكاتب سند,,+968 80077000,www.mol.gov.om,[1] الدخول على خدمة إرجاع العامل على رأس العمل بخدمات القوى العاملة غير العمانية في خدمات أصحاب العمل من قبل المفوض بالتوقيع بواسطة البطاقة المدنية أو الهاتف الداعمة لخاصية التصديق الإلكتروني. || [2] اختيار العامل المراد إرجاعه على رأس العمل من سجل تصريح مزاولة العمل ، واختيار إرجاع على رأس العمل من قائمة خيارات إجراءات تصاريح العمل من الشاشة الجانبية . || [3] مراجعة طلب إرجاع على رأس العمل. || [4] إرسال الطلب.,,4,,https://www.mol.gov.om/ManpowerAllEServices/Details/Reactivate-Work-permit-335
100336,خدمة إرجاع العامل على رأس العمل (الأفراد),Reactivate Work Permit Individuals,وزارة العمل,Ministry of Labour,124,,,"من الحكومة إلى قطاع الأعمال(G2B),من الحكومة الى الأفراد(G2C)",خدمات المواطنين > خدمة إرجاع العامل على رأس العمل (الأفراد),تُتيح خدمة إرجاع العامل على رأس العمل لأصحاب العمل(الأفراد) تقديم طلب إرجاع العامل على رأس العمل بعد إلغاء تصريح العمل له بالخطأ وبشرط ان يكون العامل داخل السلطنة و تأشيرته ليست ملغيه .,"This service allows individual employers to request the reactivation of a worker's work permit if it was cancelled by mistake, provided the worker is still in Oman and their visa is valid.",,,البطاقة المدنية لصاحب العمل ; جواز سفر العامل ; تصريح العمل الأصلي أو رقم التصريح ؛ إثبات بصلاحية تأشيرة العامل,Civil ID of the employer ; Worker's passport ; Original work permit or permit number ; Proof of worker's valid visa,لا توجد,,الكتروني,يوم واحد لمراجعة واعتماد الطلب من الدائرة المعنية بالوزارة.,,,,بوابة الخدمات الإلكترونية - الموقع الإلكتروني مكاتب سند,,+968 80077000,www.mol.gov.om,[1] الدخول على خدمة إرجاع العامل على رأس العمل بخدمات المواطنين في خدمات الأفراد بواسطة البطاقة المدنية أو الهاتف الداعمة لخاصية التصديق الإلكتروني. || [2] اختيار العامل المراد إرجاعه على رأس العمل من سجل تصريح مزاولة العمل ، واختيار إرجاع على رأس العمل من قائمة خيارات إجراءات تصاريح العمل من الشاشة الجانبية . || [3] مراجعة طلب إرجاع على رأس العمل. || [4] إرسال الطلب.,,4,,https://www.mol.gov.om/ManpowerAllEServices/Details/Reactivate-Work-permit-Individuals-336
100337,خدمة تعديل المشاريع,Project Amendment,وزارة العمل,Ministry of Labour,124,,,من الحكومة الى الأفراد(G2C),خدمات القوى العاملة الغير عمانية > خدمة تعديل المشاريع,تمكن صاحب العمل من تعديل بيانات المشروع المسجل النشط وهي اسم المشروع باللغة العربية والإنجليزية و قيمة المشروع و تاريخ بدء و انتهاء المشروع ، بالإضافة إلى تعديل الوثائق المرفقة مثل مخطط المساحة (الكروكي) و الإباحة.,"Allows employers to amend details of an active registered project, including the project name in Arabic and English, project value, and start and end dates, as well as attached documents such as the site layout (sketch) and permit.",,,البطاقة المدنية لصاحب العمل ; جواز سفر صاحب العمل (إذا كان غير عماني) ; رقم تسجيل المشروع ; نسخة من مخطط المساحة (الكروكي) المُعدّل ; نسخة من الإباحة المُعدّلة,Civil ID of the employer ; Passport of the employer (if non-Omani) ; Project registration number ; Updated site layout (sketch) ; Updated permit,لا يوجد,,الكتروني,يعتمد وقت معالجة الطلب على استيفاء جميع اشتراطات الوزارة و المستندات المطلوبة.,,,,بوابة الخدمات الإلكترونية - الموقع الإلكتروني مكاتب سند,,+968 80077000,www.mol.gov.om,[1] الدخول على خدمات أصحاب العمل بالموقع الالكتروني للوزارة ، واختيار خدمة تعديل المشاريع باستخدام قارئ البطاقة الشخصية المزودة بخاصية التصديق الإلكتروني أو الهاتف المزود بشريحة داعمة للتصديق الإلكتروني (PKI). || [2] تحديد المشروع من قائمة سجل المشاريع اختيار تعديل مشروع من قائمة الخيارات. || [3] تعديل بيانات المشروع المراد تحديثها ورفع المستندات المطلوبة. || [4] إرسال الطلب.,,4,,https://www.mol.gov.om/ManpowerAllEServices/Details/Project-amendment-337
100338,طلبات دعم التدريب على رأس العمل ( دعم الأجور ),On Jb Training Support Applications,وزارة العمل,Ministry of Labour,124,,,من الحكومة الى الأفراد(G2C),خدمات القوى العاملة العمانية > طلبات دعم التدريب على رأس العمل ( دعم الأجور ),تُقدَّم هذه الخدمة لدعم شريحة من الشركات والمؤسسات المسجَّلة في سلطنة عُمان، من خلال المساهمة في تكاليف تدريب الموظفين العُمانيين أثناء عملهم، بالإضافة إلى دعم جزء من رواتبهم خلال فترة التدريب المحددة. تُعرّف فترة التدريب على رأس العمل بأنها المدة المتفق عليها في العقد، وتتراوح بين سنة واحدة إلى سنتين كحد أقصى. وتهدف الخدمة إلى تطوير مهارات الكوادر الوطنية، وتعزيز خبراتهم العملية بما يتناسب مع احتياجات سوق العمل، والمساهمة في رفع نسب التوظيف والاستدامة الوظيفية. يتم تقديم الدعم بناءً على معايير وضوابط محددة لضمان تحقيق الأهداف المرجوة للطرفين.,"This service supports registered Omani companies and institutions by contributing to the costs of on-the-job training for Omani employees and partially subsidizing their salaries during a defined training period, which ranges from one to two years as agreed in the contract. It aims to develop national workforce skills, enhance practical experience aligned with labor market needs, and improve employment rates and job sustainability.",,,رسالة الإلتزام من الشركة ; كشف حساب بنكي لآخر 3 أشهر; المشاريع القائمة,Civil ID ; Company commitment letter ; Bank statement for the last 3 months ; List of ongoing projects,لا يوجد,,الكتروني,خدمة ذاتية,,,,بوابة الخدمات الإلكترونية - الموقع الإلكتروني مكاتب سند,,+968 80077000,www.mol.gov.om,,,0,,https://www.mol.gov.om/ManpowerAllEServices/Details/On-Jb-Training-Support-Applications-338
100339,طلبات دعم التدريب المقرون بالتشغيل,Training For Employment Support Applications,وزارة العمل,Ministry of Labour,124,,,من الحكومة الى الأفراد(G2C),خدمات القوى العاملة العمانية > طلبات دعم التدريب المقرون بالتشغيل,تمكن هذه الخدمــة المؤسسات التدريبية الخاصة من تقديم طلبات دعم التدريب المقرون بالتشغيل مع ذكر الشركات المستهدفة بحيث تساهم وزارة العمل فــي تدريـب الموظفيـن الُعمانييـن أثنـاء تدريبهم لتتم عملية التوظيف بعد التدريب لدى الشركات المشاركة في البرنامج .,"This service enables private training institutions to submit Training for Employment Support applications, specifying target companies; the Ministry of Labour supports the training of Omani employees during the program, with subsequent employment at participating companies.",,,تصنيف المؤسسة التدريبية; محتوى البرنامج; خطة التدريب; جدول الساعات; الاعتمادات الدولية والمحلية الازمة للبرنامج (إن وجد),Training institution classification ; Program curriculum ; Training plan ; Hourly schedule ; Relevant international and local program accreditations (if applicable),لا يوجد,,الكتروني,خدمة ذاتية,,,,بوابة الخدمات الإلكترونية - الموقع الإلكتروني مكاتب سند,,+968 80077000,www.mol.gov.om,,,0,,https://www.mol.gov.om/ManpowerAllEServices/Details/Training-for-Employment-support-applications-339
