ServiceID,ServiceNameAr,ServiceNameEn,EntityAr,EntityEn,EntityID,EntityDepartmentAr,EntityDepartmentEn,Beneficiary,MainService,DescriptionAr,DescriptionEn,SpecialConditionsAr,SpecialConditionsEn,RequiredDocumentsAr,RequiredDocumentsEn,FeesAr,FeesEn,PaymentMethod,AvgTimeTakenAr,AvgTimeTakenEn,WorkingTimeAr,WorkingTimeEn,Channels,InputChannelOthers,CustomerCarePhone,Website,ProcessStepsAr,ProcessStepsEn,NumSteps,AudienceVisitCount,ServiceURL
100276,قبول عقد العمل لبعض الوقت (الأفراد),Part Time Contract Individuals,وزارة العمل,Ministry of Labour,124,,,من الحكومة الى الأفراد(G2C),خدمات الباحثين عن عمل > قبول عقد العمل لبعض الوقت (الأفراد),تمكن هذه الخدمة المواطن العماني (الباحث عن عمـل، أو المتقاعد أو طلبة التعليم العام أو التعليم العالي أو العاملين فـي القطاع الخاص) من الإطلاع على عروض عقود عمل لبعض الوقت المرسله بواسطة المنشآت ليقوم بإجراء الموافقة أو الرفض بعد قراءة كافة بنود العمل العقد المقدمة، للعلم : لا تؤثر على البيانات الأساسية في السيرة الذاتية بسجل القوى العاملة بناءاً على القرار 115/2021. كما يمكنه طباعة العقد وأيضاً من خلال هذه الخدمة يستطيع تسجيل الإستقالة إلكترونيا من خلال موقع الوزارة. إضافة إلى أنه يمكنه قبول أو رفض طلب تمديد عقد العمل لبعض الوقت.,"This service allows Omani citizens (job seekers, retirees, general or higher education students, or private sector employees) to view part-time job contract offers sent by establishments, and accept or reject them after reviewing all contract terms. It does not affect core data in the National Labour Register CV per Ministerial Decision No. 115/2021. Users can also print the contract, submit resignation electronically, and accept or reject requests to extend a part-time contract.",,,إستمارة تعهد موقعة من ولي الأمر ونسخة من صورة البطاقة الشخصية لولي الأمر لمن هم أقل من 18 سنة.,Civil ID ; Signed commitment form by legal guardian ; Copy of legal guardian's Civil ID (for applicants under 18 years old),لا توجد رسوم.,,الكتروني,خدمة ذاتية,,,,بوابة الخدمات الإلكترونية - الموقع الإلكتروني مكاتب سند,,+968 80077000,www.mol.gov.om,[1] يقوم الطرف الثاني (الباحث عن عمـل، أو المتقاعد أو طلبة التعليم العام أو التعليم العالي أو العاملين فـي القطاع الخاص) بإستعراض كافة عقود العمل لبعض الوقت المقدمة لهم من قبل أصحاب العمل من خلال صفحة العقود. || [2] يمكن للطرف الثاني الموافقة على أكثر من عقد. || [3] عند قبول العقد يقوم النظام بإرسال رسالة نصية قصيرة و بريد إلكتروني لصاحب العمل فى حال توفر بيانات التواصل || [4] في حالة موافقة الطرف الثاني على العقد، يصبح حالة العقد معتمد. تقديم إستقالة عقد عمل لبعض الوقت: يستطيع الطرف العمل تسجيل إستقالتة للمنشأه من خلال الخدمة المتوفرة بالموقع. ولا يسمح النظام بتسجيل تاريخ إستقالة في فترة أقل من (7) أيام من تاريخ تقديم الإستقالة حيث أنها تعتبر فترة إخطار للمنشأة وتتم إجراءات الإقالة كالتالي: || [1] يقوم الموظف بالدخول للنظام وتسجيل إستقالة على العقد الفعال. || [2] إختيار تاريخ الإستقالة وأيضا السبب وإضافة الملاحظات إن وجدت. || [3] لا يتم تفعيل إنهاء العقد إلا فى التاريخ المحدد للإستقالة. || [4] يقوم النظام بإرسال رسالة نصية و بريد إلكتروني لصاحب العمل المقدم للعقد لإخطاره بالإستقالة فى حالة توفر بيانات التواصل للصاحب العمل. تمديد عقد العمل لبعض الوقت: || [1] في حالة قيام المنشأة بتسجيل طلب تمديد لعقد يصل العامل إخطار عن طريق البريد الإلكتروني ورسالة نصية قصيرة ، فعلى العامل الدخول على النظام والإطلاع على تفاصيل الطلب ومن ثم يقوم بالموافقة او الرفض. || [2] يقوم النظام بإرسال رسالة نصية و بريد إلكتروني لصاحب العمل المقدم فى حالة توفر بيانات التواصل للصاحب العمل. || [3] في حالة موافقة العامل على تمديد العقد، يتم إحتساب إجمالى خبرة العامل بكل المدة التى عمل بها لدى صاحب العمل. **للمزيد من التفاصيل يرجى الاطلاع على دليل المستخدم**,,11,,https://www.mol.gov.om/ManpowerAllEServices/Details/Part-Time-Contract-Individuals-276
100279,إلغاء تصاريح مزاولة العمل (المنشآت),Cancellation Of Work Permit Establishments,وزارة العمل,Ministry of Labour,124,,,من الحكومة إلى قطاع الأعمال(G2B),خدمات القوى العاملة الغير عمانية > إلغاء تصاريح مزاولة العمل (المنشآت),"تتيح خدمة "" إلغاء تصريح مزاولة العمل"" لأصحاب العمل (المنشآت) إلغاء تصاريح مزاولة العمل للقوى العاملة غير العمانية ، سواء كان ذلك بسبب نهاية الخدمة أو لأي سبب آخر.","This service allows employers (establishments) to cancel work permits for non-Omani workers, whether due to termination of employment or other reasons.",,,إذا كان سبب الإلغاء أحد ما يلي: - تغيير تأشيرة العامل إلى تأشيرة الإقامة العائلية - تغيير تأشيرة العامل إلى تأشيرة الرحلات المتعددة (أصحاب العقارات) - تغيير تأشيرة العامل إلى تأشيرة زوجة مواطن - نقل العامل للعمل في القطاع الحكومي - تغيير تأشيرة العامل إلى تأشيرة دراسية بعد ذلك ، يجب تقديم إثبات لإلغاء التأشيرة صادر عن شرطة عمان السلطانية ، من أجل الانتهاء من عملية الإلغاء.,Civil ID ; Passport ; Work permit to be cancelled ; Official cancellation confirmation from Royal Oman Police (if applicable per reason),لا يوجد,,الكتروني,الخدمة ذاتية,,,,بوابة الخدمات الإلكترونية - الموقع الإلكتروني مكاتب سند,,+968 80077000,www.mol.gov.om,,,0,,https://www.mol.gov.om/ManpowerAllEServices/Details/Cancellation-of-work-permit-establishments-279
100280,نقل خدمات القوى العاملة غير العمانية (المنشآت),Work Permit Transfer Establishments,وزارة العمل,Ministry of Labour,124,,,من الحكومة الى الأفراد(G2C),خدمات القوى العاملة الغير عمانية > نقل خدمات القوى العاملة غير العمانية (المنشآت),تتيح خدمة نقل خدمات القوى العاملة غير العمانية لأصاحب العمل (المنشآت) نقل خدمات العامل إلى صاحب عمل آخر.,This service allows employers (establishments) to transfer the work permit of a non-Omani worker from one employer to another.,,,البطاقة المدنية لصاحب العمل أو الجواز السفر ; عقد العمل الأصلي للعامل ; شهادة إخلاء طرف من صاحب العمل السابق ; جواز سفر العامل ; رقم تصريح العمل الحالي,Employer's Civil ID or passport ; Worker's original employment contract ; No-objection certificate (NOC) or release letter from previous employer ; Worker's passport ; Current work permit number,رسوم نقل الخدمات 5 ر.ع .,,الكتروني,خدمة ذاتية,,,,بوابة الخدمات الإلكترونية - الموقع الإلكتروني مكاتب سند,,+968 80077000,www.mol.gov.om,[1] الدخول على الخدمة من قبل أصحاب العمل (أحد المفوضين بالتوقيع أو ممثل المنشأة من خلال البطاقة المدنية أو بطاقة الهاتف الداعمة لنظام التصديق الالكتروني - PKI . || [2] من صفحة قائمة طلبات تصريح العمل، يبدأ صاحب العمل الجديد في تقديم طلب نقل خدمات القوى العاملة غير العمانية. || [3] كجزء من عملية تقديم الطلب، يجب على صاحب العمل الجديد تقديم البيانات التالية: الرقم المدني مع تاريخ الميلاد للعامل الذي سيتم نقل خدماته وتصريح العمل الذي سيتم استخدامه للعامل المراد نقل خدماته. || [4] بمجرد تقديم طلب نقل خدمات القوى العاملة غير العمانية، يتم تحويل الطلب لصاحب العمل الحالي للموافقة أو الرفض. || [5] يقوم صاحب العمل الحالي بالدخول على الخدمة من خلال البطاقة المدنية أو بطاقة الهاتف الداعمة لنظام التصديق الالكتروني - PKI. || [6] يمكن لصاحب العمل الحالي الإطلاع على طلب نقل الخدمات المراد الموافقة عليه. || [7] كجزء من عملية الموافقة، سيقوم صاحب العمل الحالي بدفع أي رسوم وغرامات مستحقة . || [8] بعد الموافقة، يقوم صاحب العمل الجديد بالدخول على الخدمة، ودفع رسوم النقل. || [9] بعد إتمام عملية الدفع من قبل صاحب العمل الجديد ، يتم انتظار تأكيد طلب نقل الخدمات من شرطة عمان السلطانية (تلقائي). || [10] بمجرد استلام التأكيد، يتم نقل خدمات العامل إلى صاحب العمل الجديد.,,10,,https://www.mol.gov.om/ManpowerAllEServices/Details/Work-Permit-Transfer-establishments-280
100281,تعديل بيانات القوى العاملة غير العمانية (المنشآت),Work Permit Amendment Establishments,وزارة العمل,Ministry of Labour,124,,,من الحكومة إلى قطاع الأعمال(G2B),خدمات القوى العاملة الغير عمانية > تعديل بيانات القوى العاملة غير العمانية (المنشآت),"تتيح خدمة "" تعديل بيانات القوى العاملة غير العمانية "" لأصحاب العمل (المنشآت) تعديل بيانات القوى العاملة التي تعمل بالمنشأة.",This service allows employers (establishments) to amend the personal and employment details of their non-Omani workers.,,,البطاقة المدنية للمؤسسة أو السجل التجاري ; جواز سفر العامل غير العماني ; رقم تصريح العمل الحالي ; إثبات التعيين أو عقد العمل,Civil ID or commercial registration of the establishment ; Passport of the non-Omani worker ; Current work permit number ; Employment confirmation or employment contract,رسوم تعديل البيانات 5 ر.ع .,,الكتروني,خدمة ذاتية,,,,بوابة الخدمات الإلكترونية - الموقع الإلكتروني مكاتب سند,,+968 80077000,www.mol.gov.om,[1] الدخول على الخدمة من قبل أصحاب العمل (المفوض بالتوقيع أو ممثل المنشأة) من خلال البطاقة المدنية أو بطاقة الهاتف الداعمة لنظام التصديق الالكتروني - PKI || [2] من صفحة قائمة تصاريح العمل، يختار صاحب العمل تصريح العمل المراد تعديل بياناته. || [3] يقوم صاحب العمل بإجراء التعديلات المطلوبة. ويسمح لصاحب العمل تعديل المهنة ،الفرع ، النشاط ، بيانات العقد، والأجر والعلاوات. || [4] عند طلب تعديل المهنة أو النشاط للعامل، سيتم التحقق من التعمين. || [5] بعد الموافقة، يقوم صاحب العمل بدفع رسوم خدمة التعديل.,,5,,https://www.mol.gov.om/ManpowerAllEServices/Details/Work-Permit-Amendment-establishments-281
100282,تجديد بيانات القوى العاملة غير العُمانية (المنشآت),Work Permit Renewal Establishments,وزارة العمل,Ministry of Labour,124,,,من الحكومة إلى قطاع الأعمال(G2B),خدمات القوى العاملة الغير عمانية > تجديد بيانات القوى العاملة غير العُمانية (المنشآت),"تتيح خدمة "" تجديد بيانات القوى العاملة غير العمانية "" لأصحاب العمل (المنشآت)، تجديد تصاريح العمال التي انتهت أو شارفت على الانتهاء.",This service allows employers (establishments) to renew work permits for non-Omani workers whose permits have expired or are about to expire.,,,البطاقة المدنية لصاحب المنشأة أو الجواز السفر ; تصريح العمل المنتهي أو شبه المنتهي ; سجل تجاري مُحدَّث ; عقد عمل ساري المفعول ; إثبات دفع الرسوم الحكومية,Civil ID or passport of the establishment owner ; expiring or expired work permit ; updated commercial registration ; valid employment contract ; proof of government fee payment,تحديد رسوم تجديد تصريح العمل يعتمد على مدة التصريح ونوع ومستوى المهن,,الكتروني,الخدمة ذاتية,,,,بوابة الخدمات الإلكترونية - الموقع الإلكتروني مكاتب سند,,+968 80077000,www.mol.gov.om,[1] الدخول على الخدمة من خلال بطاقة المدنية أو بطاقة الهاتف الداعمة لـنظام التصديق الالكتروني - PKI . || [2] تحديد العامل المراد تجديد بياناته،ثم البدء بطلب التجديد. || [3] سيتم تجديد تصريح العمل مباشرة بعد ارسال الطلب.,,3,,https://www.mol.gov.om/ManpowerAllEServices/Details/Work-Permit-Renewal-establishments-282
100283,تسجيل بيانات العامل (المنشآت),Work Permit Issuance Establishments,وزارة العمل,Ministry of Labour,124,,,من الحكومة إلى قطاع الأعمال(G2B),خدمات القوى العاملة الغير عمانية > تسجيل بيانات العامل (المنشآت),"تتيح خدمة "" تسجيل بيانات العامل"" لأصحاب العمل (المنشآت) تسجيل بيانات العمال بعد وصولهم.",This service allows employers (establishments) to register worker data after the worker's arrival in Oman.,,,البطاقة المدنية للمؤسسة أو السجل التجاري ; جواز سفر العامل ; عقد العمل المعتمد ; شهادة خلو من الأمراض الصادرة من مركز صحي معتمد,Civil ID or commercial registration of the establishment ; Worker's passport ; Approved employment contract ; Medical fitness certificate issued by an approved health center,لا توجد,,الكتروني,الخدمة ذاتية,,,,بوابة الخدمات الإلكترونية - الموقع الإلكتروني مكاتب سند,,+968 80077000,www.mol.gov.om,[1] الدخول على الخدمة من قبل المفوض بالتوقيع أو ممثل المنشأة من خلال البطاقة المدنية أو بطاقة الهاتف الداعمة لنظام التصديق الالكتروني - PKI . || [2] تعبئة البيانات المطلوبة في طلب تسجيل بيانات العامل (بما في ذلك على سبيل المثال لا الحصر: الأجور والعلاوات للعامل، مدة العقد، رقم الهاتف للعامل ، المؤهل العملي وما إلى ذلك). || [3] سيتم إصدار تصريح العمل مباشرة بعد تقديم طلب تسجيل بيانات العامل.,,3,,https://www.mol.gov.om/ManpowerAllEServices/Details/Work-Permit-Issuance-establishments-283
100284,إصدار تصاريح مزاولة العمل التجاري (المنشآت),Commercial Work Permit Establishments,وزارة العمل,Ministry of Labour,124,,,من الحكومة إلى قطاع الأعمال(G2B),خدمات القوى العاملة الغير عمانية > إصدار تصاريح مزاولة العمل التجاري (المنشآت),"تسمح خدمة ""إصدار تصاريح مزاولة العمل التجاري"" لأصحاب العمل تقديم طلب الحصول على تصاريح العمل للقوى العاملة والمستثمرين، كما تسمح ب: - طلب تصاريح عمل بدل مغادر - طلب تصاريح عمل المغادرة المبكرة - تعديل تصاريح العمل - رفع الوثائق المطلوبة - دفع رسوم تصاريح العمل الكترونيا مع العلم: يتم التحقق من بيانات مقدم الطلب بشكل الي من خلال الرقم المدني وذلك بحكم الربط مع الإدارة العامة للأحوال المدنية،كذلك يتم التحقق من بيانات السجل التجاري اليا من نظام وزارة التجارة والصناعة دون الحاجة إلى إرفاق مستندات السجل عند تقديم الطلب.","The Commercial Work Permit (Establishments) service enables employers to apply for work permits for non-Omani workers and investors, including replacement permits for those who have left Oman, early exit permits, and permit amendments. It also allows uploading required documents and paying permit fees electronically.",,,الاطلاع على دليل الخدمات للتعرف على المستندات المتعلقة بالأنشطة الاقتصادية و المهن المراد التصريح لها منها: - الترخيص البلدي و عقود الإيجار - ترفق من خلال إدارة وثائق المنشأة (المنشآت) - الوثائق المطلوبة حسب نوع النشاط والمهن المراد التصريح فيها ، وتٌحدد أثناء عملية تقديم الطلب في خطوة الوثائق مثل المؤهلات العلمية. - موافقات جهات الاختصاص للمهن الاختصاصية في الأنشطة الصحية و التعليمية و غيرها.,Civil ID ; Valid Commercial Registration ; Municipal License ; Lease Agreement ; Qualification Certificates (as applicable to the activity and profession),وفق القرار الوزاري (340/2016 ) وتعديلاته و تحتسب رسوم تراخيص استقدام قوى عاملة غير عمانية و تسجيل بيانات العامل حسب فئات المهن ومدة الترخيص : الرسم حسب فئات المهن: - فئات المهن الأولى : الرسم301 - فئات المهن الثانية : الرسم 251 - فئات المهن الثالثة : الرسم 201 يمكن الاطلاع على ملف تصنيف المهن في منشآت القطاع الخاص على الموقع الالكتروني للوزراة.,,الكتروني,تتفاوت مدة معالجة و اعتماد الطلبات المقدمة من أسبوع الى أسبوعين بناء على الطلب وما يتطلبه من إجراءات مثل تحليل التعمين بالنسبة للمنشآت غيرالمحققة لنسبة التعمين ، و استيفاء الاشتراطات الأخرى و مراجعة الوثائق ، و الأنشطة التي تتطلب زيارة تفتيشية قبل التصريح لها .,,,,بوابة الخدمات الإلكترونية - الموقع الإلكتروني مكاتب سند,,+968 80077000,www.mol.gov.om,[1] الدخول على بوابة الخدمات الإلكترونية لأصحاب العمل واختيار خدمة إصدار تصاريح العمل التجارية وذلك باستخدام قاريء البطاقة الشخصية أو الهاتف النقال المدعمة بخاصية التصديق الإلكتروني. || [2] تعبئة البيانات المطلوبة لاستقدام قوى عاملة غير عمانية وتتضمن مكتب العمل النشاط مكان مزاولة العمل - عدد القوى العاملة والمهنة والبيانات الشخصية للقوى العاملة (في حالة كانت المهن اختصاصية). || [3] رفع نسخ من الوثائق المطلوبة. || [4] سيقوم موظف الوزارة بمراجعة الطلب و اتخاذ القرار بشأنه سواء قبول أو رفض أو طلب تحديث للطلب. || [5] سيقوم النظام بإرسال إشعار عبر الرسائل النصية القصيرة والبريد الالكتروني مقدم الطلب حسب حالة الطلب. || [6] بعد اعتماد الطلب ، يجب على مقدم الطلب دفع الرسوم إلكترونياً. || [7] يمكن لمقدم الطلب طباعة الموافقة المبدئية لتصريح العمل والتوجه إلى شرطة عمان السلطانية لاستكمال إجراءات إصدار التأشيرة.,,7,,https://www.mol.gov.om/ManpowerAllEServices/Details/Commercial-Work-Permit-establishments-284
